{
  "schemaVersion": "1",
  "repositoryCommitSha": "bf89b29a8781f1becb1c34e3195eb7380bb5de3d",
  "sourceTreeSha256": "3a15b285af5aa7452db9af25b81112096994f962c5d07ca73420e60643ee903d",
  "sarifRegressToolVersion": "0.1.0-rc.1",
  "matcherAlgorithmVersion": "sarifregress/matcher/v3.2",
  "fingerprintAlgorithmVersions": [
    {
      "name": "derived-fingerprint",
      "version": "rule-path-context/v2"
    },
    {
      "name": "derived-fingerprint-compare",
      "version": "sarifregress/derived-fingerprint-compare/v2"
    },
    {
      "name": "embedded-snippet",
      "version": "embedded-snippet/v1"
    },
    {
      "name": "producer-fingerprint-common",
      "version": "sarifregress/producer-fingerprint-common-version/v1"
    }
  ],
  "outputSchemaVersion": "1",
  "configurationSchemaVersion": "1",
  "holdoutManifestSha256": "b9cf6325e2758889449aa021b5b45b3636e17a0dcf65d3c7dba215c2964fe379",
  "environment": {
    "operatingSystem": "linux",
    "architecture": "x64",
    "dotnetSdkVersion": "10.0.302"
  }
}
